{
  "schema_version": "0.1.0",
  "status": "frozen",
  "provenance": {
    "source_pdf_sha256": "b048d09835c66522cc7a6d93e3edf4693edacc403aa79f738c47a421d840f761",
    "prior_exposure": "Second source-only repair after conventional/statistical exposure; no renewed blind claim. Original prototype definitions and gates transferred without refitting.",
    "comparison_data_withheld": false,
    "run_id": "tracked_snapshot_v11",
    "frozen_sha256": null
  },
  "views": [
    {
      "view_id": "V_115",
      "pdf_page": 115,
      "image_sha256": "2bf46dbeaaaab4a97075f46f503582da0eef2b352eb92277d7a3b6db1a3a0b8c",
      "image_path": "data/source/yale_native/1006187.jpg",
      "width_px": 3028,
      "height_px": 3769,
      "split": "train"
    }
  ],
  "panels": [],
  "lines": [],
  "groups": [],
  "components": [],
  "assemblies": [],
  "segmentations": [],
  "observations": [],
  "hypotheses": [
    {
      "hypothesis_id": "V_115_TRACKED_BOUNDARIES",
      "proposition": "Local density tracking improves some candidate writing flows; four geometric partitions still compete and complete writing membership is unvalidated.",
      "supporting_observations": [],
      "contradicting_observations": [],
      "falsifier": "Independent source review finds missing writing, drawings or inconsistent reusable structures.",
      "confidence": "unresolved",
      "next_test": "Post-snapshot positional/context tests and source-audited conventional crosswalk; no inherited boundary truth."
    }
  ]
}