{
  "schema_version": "0.1.0",
  "status": "frozen",
  "provenance": {
    "source_pdf_sha256": "b048d09835c66522cc7a6d93e3edf4693edacc403aa79f738c47a421d840f761",
    "prior_exposure": "Supplied handoff, chats and ledger contain conventional examples; transcription contents withheld throughout visual derivation.",
    "comparison_data_withheld": true,
    "run_id": "visual_snapshot_v0",
    "frozen_sha256": null
  },
  "views": [
    {
      "view_id": "V_124",
      "pdf_page": 124,
      "image_sha256": "4b0f31d1e08b8f026886aa599232b7dfcd33417b1eef43a44e619c3ebd21faa5",
      "image_path": "data/source/yale_native/1006196.jpg",
      "width_px": 7993,
      "height_px": 3828,
      "split": "train"
    }
  ],
  "panels": [],
  "lines": [],
  "groups": [],
  "components": [],
  "assemblies": [],
  "segmentations": [],
  "observations": [],
  "hypotheses": [
    {
      "hypothesis_id": "V_124_UNIT_BOUNDARIES",
      "proposition": "Raster components, medium assemblies, compounds and group-only partitions compete; no partition is canonical grapheme truth.",
      "supporting_observations": [],
      "contradicting_observations": [],
      "falsifier": "Independent source annotation and held-out template prediction fail to support stable reusable structures.",
      "confidence": "unresolved",
      "next_test": "Source quality, frame/cut geometry, contextual allography and cross-transcription comparison AFTER snapshot freeze."
    }
  ]
}